id,imageUrl,name,description,favourite
1,https://www.licious.in/blog/wp-content/uploads/2023/01/Shutterstock_2047827035-1024x683.jpg,"Chicken Briyani","
Chicken Biryani is a flavorful and aromatic dish that originated from the Indian subcontinent, believed to have been brought by Persian or Mughal influences. The term "biryani" comes from the Persian word "birian," meaning "fried before cooking." This dish, which became popular during the Mughal era, involves layering marinated chicken with basmati rice, spices, and herbs, and cooking it slowly using the "dum" method. Over time, chicken biryani evolved into various regional styles across India, each adding its own unique blend of spices and techniques, making it a beloved and diverse culinary tradition.",1
2,https://encrypted-tbn0.gstatic.com/images?q=tbn:ANd9GcTNO238UES5bTWOiJIWnKde5NvlkWpYc9F-BV4nVBB3AaC9Cw3V6QJrdc9GRWBYep1qjV8&usqp=CAU,"Mutton Briyani","Mutton Biryani is a rich and aromatic rice dish that has deep roots in the culinary traditions of the Indian subcontinent, particularly influenced by Persian and Mughal cuisines. The dish consists of marinated mutton (goat or lamb) cooked with basmati rice, a medley of spices, and herbs, often slow-cooked using the "dum" method, where the pot is sealed to allow the flavors to meld together. The preparation begins with marinating the mutton in yogurt, ginger, garlic, and a mix of spices, such as cumin, coriander, and garam masala, which tenderizes the meat and infuses it with flavor. The rice is typically parboiled with whole spices like cardamom, cloves, and cinnamon before being layered with the mutton and cooked in a sealed pot. Saffron and ghee are often added to enhance the richness and aroma. Mutton Biryani varies regionally, with famous versions including the Hyderabadi Biryani, known for its spiciness and distinct flavor, and the Lucknowi (Awadhi) Biryani, which is milder and more fragrant. The dish is traditionally served with raita (a yogurt-based side dish), boiled eggs, and salad, making it a complete and hearty meal that reflects the opulence of Indian cuisine.",0
3,"https://static.toiimg.com/thumb/msid-76344801,imgsize-81967,width-400,resizemode-4/76344801.jpg",Parotta,"Parotta is a popular Indian flatbread, particularly cherished in South Indian cuisine, known for its flaky, layered texture and rich, buttery flavor. Originating from the Tamil Nadu region, parotta is made from a dough that is kneaded, rolled out, and folded multiple times to create its signature layers. The dough is then pan-fried to achieve a crispy, golden-brown exterior while remaining soft and layered inside. Often enjoyed with a variety of accompaniments such as curries, gravies, or vegetables, parotta is a versatile bread that complements both vegetarian and non-vegetarian dishes. Its preparation involves a skillful technique of folding and rolling, which gives it a unique texture and makes it a favorite in street food stalls and traditional meals across South India.",0
5,https://www.kannammacooks.com/wp-content/uploads/Murungakkai-Sambar-kannammacooks.com-Recipe-Tamilnadu-Madras-style-murungakkai-sambar-idli-Indian-Chennai-drumstick-Sambar-1.jpg,"Sambar Rice","Sambar rice is a comforting and nutritious South Indian dish that combines rice with sambar, a hearty and tangy lentil-based stew. It is a staple in South Indian cuisine, cherished for its balanced flavors and ease of preparation. The dish typically features cooked rice mixed with sambar, which is made from toor dal (pigeon peas), tamarind, and a blend of aromatic spices such as mustard seeds, cumin, coriander, and curry leaves. Vegetables like carrots, beans, and potatoes are often added to enhance its nutritional value and texture. Sambar rice is usually served with a side of yogurt or pickles, and it is enjoyed as a wholesome meal that offers both comfort and sustenance. Its harmonious blend of spicy, tangy, and savory flavors makes it a beloved dish in Indian households and a popular choice in restaurants and eateries.",0
